{
  "adaptation_policy": [
    "bounded_retry",
    "reduced_concurrency",
    "dependency_safe_topology_reduction"
  ],
  "completion": "accepted recommendation after required evidence and review",
  "escalation": "route to human decision/review boundary",
  "max_agent_steps": 5,
  "max_correction_rounds": 1,
  "max_total_agent_calls": 5,
  "metadata": {
    "decision_question": "Which Personal Care category should Cosluxe Nature enter first in Vietnam, and which channels should it prioritize across 2023-2025 to support stable growth of at least 8% from 2024 onward?",
    "horizon": "2023 entry; 2023-2025 channel plan; stable-growth planning from 2024 onward",
    "relevant_constraints": "Vietnam Personal Care category performance in offline channels using MAT 2YA, MAT YA, and MAT TY measures ending September 2022.|Vietnam Personal Care ecommerce category growth, new launches, and survival of new launches.|Vietnam consumer price-tier movement, essential and routine category perceptions, channel penetration, and shopping frequency.|Vietnam traditional-trade regional and urban-rural dynamics, modern-trade store universe, and channel value sales.|Cosluxe Nature portfolio focus, premium image, and natural-ingredient positioning as stated in the case materials.|Vietnam entry begins in 2023 and stable-growth planning begins from 2024 onward.|Workbook facts retain their stated source, period, units, and dummy-case status.|First entry category means the initial priority category, not exclusion of the remainder of the portfolio.|Offline and ecommerce measures are not comparable until definitions, periods, and units are normalized.|The 8% growth ambition is a planning target, not an observed result.|Confirm launch budget, margin, supply, distribution, and portfolio-cannibalization constraints with the client.|Confirm whether the recommendation optimizes revenue, profit, market share, reach, or a weighted combination.|Confirm acceptable external desk-research scope and evidence-quality threshold for claims beyond the workbook.|Reconcile category definitions and channel boundaries across the named workbook sheets.|Validate whether the 2023-2025 horizon and 2024 growth baseline match the client's planning calendar.",
    "required_capabilities": "",
    "required_participants": "",
    "selected_patterns": "sequential",
    "selection_rationale": "ordered Work Brief stages",
    "selection_source": "work_brief",
    "unresolved_capabilities": ""
  },
  "name": "ANALYZE_REVIEW",
  "partial_result": "no accepted recommendation; preserve partial state",
  "pattern": "sequential",
  "purpose": "ANALYZE_REVIEW",
  "rationale": "ordered Work Brief stages",
  "reuse_policy": "reuse only committed, provenance-complete matching receipts",
  "review_policy": "required review policy applies at the final stage",
  "roles": [
    {
      "profile": "normal",
      "purpose": "execute"
    },
    {
      "profile": "normal",
      "purpose": "review"
    }
  ],
  "stages": [
    {
      "access_scope": [
        "read:local"
      ],
      "adaptation_policy": [
        "bounded_retry",
        "reduced_concurrency",
        "dependency_safe_topology_reduction"
      ],
      "capabilities": [
        "spreadsheet_read",
        "domain_validation"
      ],
      "completion_rule": "stage output matches expected result and required checks pass",
      "decision_question": "Which Personal Care category should Cosluxe Nature enter first in Vietnam, and which channels should it prioritize across 2023-2025 to support stable growth of at least 8% from 2024 onward?",
      "dependencies": [],
      "escalation_rule": "escalate unresolved capability, contradiction, or budget exhaustion",
      "expected_result": "A source and metric dictionary with observed-versus-derived labels and unresolved comparability issues.",
      "horizon": "2023 entry; 2023-2025 channel plan; stable-growth planning from 2024 onward",
      "input_type": "typed-result",
      "limits": {
        "max_agent_steps": 5,
        "max_total_agent_calls": 5
      },
      "model": "unspecified",
      "objective": "Inventory workbook sources, definitions, periods, units, and comparability limits before calculating attractiveness.",
      "output_type": "typed-result",
      "partial_result_rule": "preserve completed evidence and mark incomplete stage explicitly",
      "participant_responsibilities": [
        {
          "participant_id": "analyst",
          "responsibility": "analyst"
        }
      ],
      "participants": [
        {
          "capability_ids": [
            "spreadsheet_read",
            "domain_validation"
          ],
          "id": "analyst",
          "profile": "normal",
          "purpose": "analyst",
          "role": "analyst",
          "unresolved_capabilities": []
        }
      ],
      "pattern": "sequential",
      "provider": "local",
      "rationale": "work_brief: ordered Work Brief stages; selected sequential for stage source-audit",
      "reasoning_controls": {},
      "relevant_constraints": [
        "Vietnam Personal Care category performance in offline channels using MAT 2YA, MAT YA, and MAT TY measures ending September 2022.",
        "Vietnam Personal Care ecommerce category growth, new launches, and survival of new launches.",
        "Vietnam consumer price-tier movement, essential and routine category perceptions, channel penetration, and shopping frequency.",
        "Vietnam traditional-trade regional and urban-rural dynamics, modern-trade store universe, and channel value sales.",
        "Cosluxe Nature portfolio focus, premium image, and natural-ingredient positioning as stated in the case materials.",
        "Vietnam entry begins in 2023 and stable-growth planning begins from 2024 onward.",
        "Workbook facts retain their stated source, period, units, and dummy-case status.",
        "First entry category means the initial priority category, not exclusion of the remainder of the portfolio.",
        "Offline and ecommerce measures are not comparable until definitions, periods, and units are normalized.",
        "The 8% growth ambition is a planning target, not an observed result.",
        "Confirm launch budget, margin, supply, distribution, and portfolio-cannibalization constraints with the client.",
        "Confirm whether the recommendation optimizes revenue, profit, market share, reach, or a weighted combination.",
        "Confirm acceptable external desk-research scope and evidence-quality threshold for claims beyond the workbook.",
        "Reconcile category definitions and channel boundaries across the named workbook sheets.",
        "Validate whether the 2023-2025 horizon and 2024 growth baseline match the client's planning calendar."
      ],
      "research_needs": [
        "ResearchNeed(kind=<ResearchNeedKind.STRUCTURED_DATA: 'STRUCTURED_DATA'>, query='Inspect the Case and Glossary sheets for business objectives, category definitions, source notes, and period conventions.', source_hint='data/exercise1-nielsenIQ/NCC 2022 - Semi Final Case - Data set.xlsx; sheets Case and Glossary')",
        "ResearchNeed(kind=<ResearchNeedKind.STRUCTURED_DATA: 'STRUCTURED_DATA'>, query='Inventory measures, units, and source notes across Macro & FMCG, Personal Care, Consumer, Channel Dynamic, Trad.Trade, Modern Trade, and Ecommerce.', source_hint='data/exercise1-nielsenIQ/NCC 2022 - Semi Final Case - Data set.xlsx; sheets Macro & FMCG, Personal Care, Consumer, Channel Dynamic, Trad.Trade, Modern Trade, Ecommerce')",
        "ResearchNeed(kind=<ResearchNeedKind.VALIDATION: 'VALIDATION'>, query='Confirm whether offline, ecommerce, value, volume, store, penetration, and frequency measures can be compared directly.', source_hint='data/exercise1-nielsenIQ/NCC 2022 - Semi Final Case - Data set.xlsx; source notes and headers')",
        "ResearchNeed(kind=<ResearchNeedKind.STRUCTURED_DATA: 'STRUCTURED_DATA'>, query='Explicitly decide whether the hidden Others sheet is included in the first-pass evidence boundary.', source_hint='data/exercise1-nielsenIQ/NCC 2022 - Semi Final Case - Data set.xlsx; hidden sheet Others')"
      ],
      "result_contract": "analysis-stage-result/v1",
      "reuse_policy": "reuse only committed, provenance-complete matching receipts",
      "review_checks": [
        "stage output validation"
      ],
      "skill_ids": [],
      "stage_id": "source-audit",
      "synthesis_policy": "aggregate-typed-results"
    },
    {
      "access_scope": [
        "read:local"
      ],
      "adaptation_policy": [
        "bounded_retry",
        "reduced_concurrency",
        "dependency_safe_topology_reduction"
      ],
      "capabilities": [
        "data_analysis",
        "calculation",
        "graph_context"
      ],
      "completion_rule": "stage output matches expected result and required checks pass",
      "decision_question": "Which Personal Care category should Cosluxe Nature enter first in Vietnam, and which channels should it prioritize across 2023-2025 to support stable growth of at least 8% from 2024 onward?",
      "dependencies": [
        "source-audit"
      ],
      "escalation_rule": "escalate unresolved capability, contradiction, or budget exhaustion",
      "expected_result": "A reproducible category scorecard with sensitivity to alternative weights and explicit unresolved assumptions.",
      "horizon": "2023 entry; 2023-2025 channel plan; stable-growth planning from 2024 onward",
      "input_type": "typed-result",
      "limits": {
        "max_agent_steps": 5,
        "max_total_agent_calls": 5
      },
      "model": "unspecified",
      "objective": "Compare candidate Personal Care categories on growth, scale, consumer relevance, portfolio fit, and competitive or launch signals.",
      "output_type": "typed-result",
      "partial_result_rule": "preserve completed evidence and mark incomplete stage explicitly",
      "participant_responsibilities": [
        {